{
  "slug": "big-body-spray",
  "url": "https://www.lush.com/us/en_us/p/big-body-spray",
  "sourceUrl": "https://www.lush.com/us/en_us/p/big-body-spray",
  "title": "Big",
  "sku": "9214-NA",
  "size": "200ml",
  "price": {
    "amount": 45.0,
    "currency": "USD",
    "formatted": "$45.00",
    "onSale": false
  },
  "availability": {
    "status": "active",
    "inStock": true,
    "isAvailableForPurchase": true,
    "quantityAvailable": 42,
    "schemaAvailability": "https://schema.org/InStock",
    "dataLocale": "us"
  },
  "description": "A gentle breeze blows through the sun soaked groves of Sicilian red mandarins, stirring cheerful notes of orange flower absolute. A touch of evocative vanilla absolute and brightening neroli oil allow any worries to float away, letting smiles shine.",
  "ingredients": [
    "Alcohol Denat.",
    "Aqua (Water)",
    "Parfum",
    "Glycerin",
    "Alpha-Isomethyl Ionone",
    "Citrus Aurantium Amara Flower Oil (Neroli Oil)",
    "Citrus Nobilis Peel Oil (Mandarin Oil)",
    "Vanilla Planifolia Fruit Extract (Vanilla Extract)",
    "Citrus Aurantium Amara Flower Extract (Orange Flower Extract)",
    "*Anise Alcohol",
    "*Citral",
    "*Coumarin",
    "*Farnesol",
    "Geraniol",
    "*Hydroxycitronellal",
    "*Limonene",
    "*Linalool"
  ],
  "badges": [
    "Vegan",
    "Vegan Society"
  ],
  "images": [
    {
      "url": "https://unicorn.lush.com/media/thumbnails/products/Big_Body_Spray_200ml_9c1f6be4_thumbnail_4096.png",
      "alt": "Big body spray. A black spray bottle of Lush \"Big\" Body Spray. The product label is black with a pale yellow banded border. White text states the product name and the scent description.",
      "thumbnail": "https://unicorn.lush.com/media/thumbnails/products/Big_Body_Spray_200ml_9c1f6be4_thumbnail_128.png"
    },
    {
      "url": "https://unicorn.lush.com/media/thumbnails/products/big_body_spray_lush_2025_01_49b19d50_thumbnail_4096.jpg",
      "alt": "",
      "thumbnail": "https://unicorn.lush.com/media/thumbnails/products/big_body_spray_lush_2025_01_49b19d50_thumbnail_128.jpg"
    },
    {
      "url": "https://unicorn.lush.com/media/thumbnails/products/big_body_spray_lush_2025_02_5fb0ad47_thumbnail_4096.jpg",
      "alt": "",
      "thumbnail": "https://unicorn.lush.com/media/thumbnails/products/big_body_spray_lush_2025_02_5fb0ad47_thumbnail_128.jpg"
    },
    {
      "url": "https://unicorn.lush.com/media/thumbnails/products/big_body_spray_lush_2025_e53be66f_thumbnail_4096.jpg",
      "alt": "",
      "thumbnail": "https://unicorn.lush.com/media/thumbnails/products/big_body_spray_lush_2025_e53be66f_thumbnail_128.jpg"
    }
  ],
  "category": "Fragrance",
  "fetchedAt": "2026-04-24T18:04:56.000Z",
  "updatedAt": "2026-04-24T18:04:56.000Z",
  "collections": [
    "Vegan",
    "Fragrances",
    "Body Sprays",
    "Vegan Perfume",
    "Ocean-inspired faves",
    "Spring Fragrance"
  ]
}